source,target,legal_entity,BLEU,METEOR,COMET,term
A staff member employed in a place where transport is recognized as being particularly difficult and expensive because of the remoteness of housing from the place of work may be paid a transport allowance.,"Einem Bediensteten, an dessen Ort der dienstlichen Verwendung die Beförderungsbedingungen wegen der Entfernung zwischen Wohnung und Arbeitsstätte als besonders schwierig und kostspielig anerkannt worden sind, kann eine Fahrkostenzulage gewährt werden.",member,0.005311256555131655,0.015060240963855423,0.9474712014198303,member
"In the event of a polygamous marriage, where the sponsor already has a spouse living with him in the territory of a Member State, the Member State concerned shall not authorise the family reunification of a further spouse.","Lebt im Falle einer Mehrehe bereits ein Ehegatte gemeinsam mit dem Zusammenführenden im Hoheitsgebiet eines Mitgliedstaats, so gestattet der betreffende Mitgliedstaat nicht die Familienzusammenführung eines weiteren Ehegatten.","state, member, marriage, sponsor, family",0.005355924989097696,0.033112582781456956,0.9450660347938538,state
The second Member State may require the family members concerned to present with their application for a residence permit:,"Der zweite Mitgliedstaat kann von den Familienangehörigen des langfristig Aufenthaltsberechtigten verlangen, ihrem Antrag auf Erteilung eines Aufenthaltstitels Folgendes beizufügen:","state, member, residence, permit, family",0.009160285722098505,0.023923444976076555,0.9564482569694519,state
The Member State concerned shall grant the family members a first residence permit of at least one year's duration.,Der betreffende Mitgliedstaat erteilt den Familienangehörigen einen ersten Aufenthaltstitel mit mindestens einjähriger Gültigkeitsdauer.,"state, member, grant, residence, permit, family",0.009134423666564471,0.03401360544217687,0.9717233180999756,state
"By way of derogation, where the legislation of a Member State relating to family reunification in force on the date of adoption of this Directive takes into account its reception capacity, the Member State may provide for a waiting period of no more than three years between submission of the application for family reunification and the issue of a residence permit to the family members.","Abweichend davon kann ein Mitgliedstaat, dessen bei Annahme der Richtlinie geltendes nationales Recht im Bereich der Familienzusammenführung die Aufnahmefähigkeit dieses Mitgliedstaats berücksichtigt, eine Wartefrist von höchstens drei Jahren, zwischen der Stellung eines Antrags auf Familienzusammenführung und der Ausstellung eines Aufenthaltstitels an Familienangehörige, vorsehen.","adoption, state, member, residence, permit, issue, legislation, family, capacity, account",0.003519816815769827,0.03,0.928630530834198,state
"In the case of a measure in the form of a grant or loan, it is normally obvious which enterprise is potentially the beneficiary for the purpose of assessing whether State aid is involved.","Bei der Vergabe eines Zuschusses oder eines Kredites ist bei der Prüfung, ob es sich um eine staatliche Beihilfe handelt, in der Regel klar, welches Unternehmen durch die betreffende Maßnahme begünstigt würde.","beneficiary, state, grant, case, loan",0.006787181501568368,0.041666666666666664,0.9518918991088867,state
