source,target,legal_entity,BLEU,METEOR,COMET,term
"A staff member who receives instructions which he considers to be irregular or likely to give rise to serious difficulties shall inform his immediate superior thereof, if necessary in writing.","Hält ein Bediensteter eine ihm erteilte Anordnung für fehlerhaft oder ist er der Meinung, daß ihre Ausführung schwerwiegende Nachteile zur Folge haben kann, so hat er seinem Vorgesetzten seine Auffassung, erforderlichenfalls schriftlich, mitzuteilen.",member,0.00575200893990609,0.026737967914438502,0.9440177083015442,member
"a loan taken up by a capital company with a member or a member's spouse or child, or a loan taken up with a third party, if it is guaranteed by a member, on condition that such loans have the same function as an increase in the company's capital.","die Darlehensaufnahme durch eine Kapitalgesellschaft bei einem Gesellschafter, beim Ehegatten oder bei einem Kind eines Gesellschafters sowie die Aufnahme von Darlehen bei Dritten, wenn ein Gesellschafter für ein solches Darlehen Sicherheit leistet; Voraussetzung ist, daß diese Darlehen die gleiche Funktion haben wie eine Erhöhung des Kapitals.","child, party, member, company, capital, loan, condition",0.004701712638603976,0.03891050583657587,0.9282602071762085,member
A staff member employed in a place where transport is recognized as being particularly difficult and expensive because of the remoteness of housing from the place of work may be paid a transport allowance.,"Einem Bediensteten, an dessen Ort der dienstlichen Verwendung die Beförderungsbedingungen wegen der Entfernung zwischen Wohnung und Arbeitsstätte als besonders schwierig und kostspielig anerkannt worden sind, kann eine Fahrkostenzulage gewährt werden.",member,0.005311256555131655,0.015060240963855423,0.9474712014198303,member
The provisions governing the financing of the common agricultural policy shall apply to the products mentioned in Article 1.,Die Bestimmungen über die Finanzierung der gemeinsamen Agrarpolitik gelten auch für die in Artikel 1 genannten Erzeugnisse.,"policy, article",0.012673718536830811,0.0824175824175824,0.9682288765907288,policy
"The operation and development of the common market for agricultural products must be accompanied by the establishment of a common agricultural policy to include, in particular, a common organisation of agricultural markets which may take various forms depending on the product.","Mit dem Funktionieren und der Entwicklung des gemeinsamen Marktes für landwirtschaftliche Erzeugnisse muss die Gestaltung einer Gemeinsamen Agrarpolitik einhergehen; sie muss insbesondere eine gemeinsame Organisation der Agrarmärkte umfassen, die je nach Erzeugnis unterschiedliche Formen annehmen kann.",policy,0.004977587797754485,0.037974683544303806,0.9423592686653137,policy
The policy may result in an extension of the useful life of the asset or an increase in its residual value.,Diese können zu einer Verlängerung der Nutzungsdauer des Vermögenswertes oder zu einer Erhöhung seines Restwertes führen.,"policy, extension, value, asset",0.008687475782716616,0.02857142857142857,0.9649092555046082,policy
"Once the appropriate initial policy has been selected under the requirements of paragraph 3, a change in accounting policy should only be made in accordance with IAS 8.42 and applied to all items or categories of items in the manner specified in paragraph 3.","Sobald erstmals eine zulässige Bilanzierungs- und Bewertungsmethode gemäß den Bestimmungen des Paragraphen 3 ausgewählt wurde, darf eine Änderung in der Bilanzierungs- und Bewertungsmethode nur gemäß IAS 8.42 vorgenommen werden; sie ist auf alle Posten oder Kategorien von Posten anzuwenden, wie in Paragraph 3 beschrieben.","policy, accounting",0.011446356251772679,0.17332635983263597,0.9329564571380615,policy
"If a standard requires or permits categorisation of items, the most appropriate accounting policy should be selected and applied consistently to each category.","Wenn ein Standard eine Kategorisierung der Sachverhalte vorschreibt oder erlaubt, ist die sinnvollste Bilanzierungs- und Bewertungsmethode auszuwählen und stetig für jede Kategorie anzuwenden.","policy, accounting",0.009009113474307318,0.06,0.9454537034034729,policy
"The Common Fisheries Policy shall cover conservation, management and exploitation of living aquatic resources, aquaculture, and the processing and marketing of fishery and aquaculture products where such activities are practised on the territory of Member States or in Community waters or by Community fishing vessels or, without prejudice to the primary responsibility of the flag State, nationals of Member States.","Die Gemeinsame Fischereipolitik erstreckt sich auf die Erhaltung, Bewirtschaftung und Nutzung lebender aquatischer Ressourcen, die Aquakultur und die Verarbeitung und Vermarktung von Erzeugnissen der Fischerei und der Aquakultur, soweit diese Tätigkeiten im Hoheitsgebiet der Mitgliedstaaten oder in Gemeinschaftsgewässern oder durch Fischereifahrzeuge der Gemeinschaft oder, unbeschadet der Tatsache, dass in erster Linie der Flaggenstaat zuständig ist, von Staatsbürgern der Mitgliedstaaten ausgeübt werden.","policy, prejudice, member, state",0.004351305916687317,0.051622418879056046,0.9209677577018738,prejudice
"Without prejudice to Articles 20 and 22 of Directive 97/78/EC, the following shall be exempted from the requirements in Article 1:",Unbeschadet der Artikel 20 und 22 der Richtlinie 97/78/EG werden folgende Erzeugnisse von den Auflagen gemäß Artikel 1 freigestellt:,"article, prejudice",0.011712916466550741,0.09852216748768473,0.9664074182510376,prejudice
The provisions of Article 15 are without prejudice to any international obligations that Member States may have entered into with respect to the abovementioned international entities.,"Die Bestimmungen des Artikels 15 gelten unbeschadet internationaler Verpflichtungen, die die Mitgliedstaaten in Bezug auf die oben aufgeführten internationalen Einrichtungen eingegangen sind.","member, article, prejudice",0.008301095462822575,0.0411522633744856,0.9540055394172668,prejudice
"Without prejudice to their respective responsibilities as defined under sectoral rules, these authorities, whether or not established in the same Member State, shall provide one another with any information which is essential or relevant for the exercise of the other authorities' supervisory tasks under the sectoral rules and this Directive.","Unbeschadet ihrer Aufgaben gemäß den Branchenvorschriften übermitteln diese Behörden den anderen zuständigen Behörden desselben Mitgliedstaats oder anderer Mitgliedstaaten alle grundlegenden oder zweckdienlichen Informationen, die diese zur Erfuellung ihrer Aufsichtspflichten gemäß den Branchenvorschriften und den Bestimmungen dieser Richtlinie benötigen.","state, member, rules, prejudice, information, relevant",0.00395365330335517,0.024096385542168676,0.9359380602836609,prejudice
"In the case of WEEE other than WEEE from private households, and without prejudice to Article 9, Member States shall ensure that producers or third parties acting on their behalf provide for the collection of such waste.","Bei nicht aus privaten Haushalten stammenden Elektro- und Elektronik-Altgeräten stellen die Mitgliedstaaten unbeschadet des Artikels 9 sicher, dass die Hersteller oder in ihrem Namen tätige Dritte für die Sammlung dieser Altgeräte sorgen.","member, article, prejudice, waste, case",0.006081389695809871,0.05780346820809248,0.9346211552619934,prejudice
"In the event of a polygamous marriage, where the sponsor already has a spouse living with him in the territory of a Member State, the Member State concerned shall not authorise the family reunification of a further spouse.","Lebt im Falle einer Mehrehe bereits ein Ehegatte gemeinsam mit dem Zusammenführenden im Hoheitsgebiet eines Mitgliedstaats, so gestattet der betreffende Mitgliedstaat nicht die Familienzusammenführung eines weiteren Ehegatten.","state, member, marriage, sponsor, family",0.005355924989097696,0.033112582781456956,0.9450660347938538,state
The second Member State may require the family members concerned to present with their application for a residence permit:,"Der zweite Mitgliedstaat kann von den Familienangehörigen des langfristig Aufenthaltsberechtigten verlangen, ihrem Antrag auf Erteilung eines Aufenthaltstitels Folgendes beizufügen:","state, member, residence, permit, family",0.009160285722098505,0.023923444976076555,0.9564482569694519,state
The Member State concerned shall grant the family members a first residence permit of at least one year's duration.,Der betreffende Mitgliedstaat erteilt den Familienangehörigen einen ersten Aufenthaltstitel mit mindestens einjähriger Gültigkeitsdauer.,"state, member, grant, residence, permit, family",0.009134423666564471,0.03401360544217687,0.9717233180999756,state
"By way of derogation, where the legislation of a Member State relating to family reunification in force on the date of adoption of this Directive takes into account its reception capacity, the Member State may provide for a waiting period of no more than three years between submission of the application for family reunification and the issue of a residence permit to the family members.","Abweichend davon kann ein Mitgliedstaat, dessen bei Annahme der Richtlinie geltendes nationales Recht im Bereich der Familienzusammenführung die Aufnahmefähigkeit dieses Mitgliedstaats berücksichtigt, eine Wartefrist von höchstens drei Jahren, zwischen der Stellung eines Antrags auf Familienzusammenführung und der Ausstellung eines Aufenthaltstitels an Familienangehörige, vorsehen.","adoption, state, member, residence, permit, issue, legislation, family, capacity, account",0.003519816815769827,0.03,0.928630530834198,state
"In the case of a measure in the form of a grant or loan, it is normally obvious which enterprise is potentially the beneficiary for the purpose of assessing whether State aid is involved.","Bei der Vergabe eines Zuschusses oder eines Kredites ist bei der Prüfung, ob es sich um eine staatliche Beihilfe handelt, in der Regel klar, welches Unternehmen durch die betreffende Maßnahme begünstigt würde.","beneficiary, state, grant, case, loan",0.006787181501568368,0.041666666666666664,0.9518918991088867,state
