source,target,legal_entity,BLEU,METEOR,COMET,term
"aid to export-related activities, namely aid directly linked to the quantities exported, to the establishment and operation of a distribution network or to other current expenditure linked to the export activity;","Beihilfen für ausfuhrbezogene Tätigkeiten, insbesondere Beihilfen, die unmittelbar mit den ausgeführten Mengen, dem Aufbau oder dem Betrieb eines Vertriebsnetzes oder anderen laufenden Ausgaben in Verbindung mit der Ausfuhrtätigkeit zusammenhängen;",distribution,0.007205335066302803,0.045317220543806644,0.9414830803871155,distribution
Distribution of this weight among the axles (distribution among axles and load on the fifth wheel king pin in the case of a semi-trailer),Verteilung dieses Gewichtes auf die Achsen (bei Sattelanhängern auf Achsen und Sattelkupplung),"case, distribution",0.008640609739997756,0.06578947368421054,0.9326823949813843,distribution
six days shall be equivalent to one week and vice versa;,SO ENTSPRECHEN EINANDER SECHS TAGE UND EINE WOCHE;,equivalent,0.017033186037639283,0.053763440860215055,0.9478963017463684,equivalent
"It shall not permit the parent company to give instructions regarding day-to-day operations, nor with respect to individual decisions concerning the construction or upgrading of transmission and distribution lines, that do not exceed the terms of the approved financial plan, or any equivalent instrument;","Dies erlaubt es dem Mutterunternehmen nicht, Weisungen bezüglich des laufenden Betriebs oder einzelne Entscheidungen über den Bau oder die Modernisierung von Fernleitungen und Verteilerleitungen zu erteilen, die über den Rahmen des genehmigten Finanzplans oder eines gleichwertigen Instruments nicht hinausgehen;","construction, equivalent, permit, instrument, company, parent, distribution",0.005034460682273033,0.04694835680751174,0.9146354794502258,equivalent
TO THE EXTENT THAT INSTRUMENTS OR APPARATUS OF EQUIVALENT SCIENTIFIC VALUE ARE NOT BEING MANUFACTURED IN THE COMMUNITY.,UND SOFERN GEGENWÄRTIG KEINE INSTRUMENTE UND APPARATE VON GLEICHEM WISSENSCHAFTLICHEM WERT IN DER GEMEINSCHAFT HERGESTELLT WERDEN.,"equivalent, value",0.012109013026441871,0.0872093023255814,0.9137742519378662,equivalent
The yellow index shall be measured according to the ICC 152 method or an equivalent recognised method.,Der Gelb-Index wird nach der Methode ICC 152 oder einer gleichwertigen anerkannten Methode bestimmt.,equivalent,0.025281168697394947,0.24313725490196078,0.9608064889907837,equivalent
2 checks to ensure that cargo entering the port facility matches the delivery note or equivalent cargo documentation;.,"2 Überprüfungen, um sicherzustellen, dass die in die Hafenanlage eingeführte Ladung mit dem Lieferschein beziehungsweise den entsprechenden Ladungsunterlagen übereinstimmt;.","delivery, equivalent, note",0.019398130898389824,0.1125795398923152,0.9380609393119812,equivalent
"It shall not permit the parent company to give instructions regarding day-to-day operations, nor with respect to individual decisions concerning the construction or upgrading of transmission and distribution lines, that do not exceed the terms of the approved financial plan, or any equivalent instrument;","Dies erlaubt es dem Mutterunternehmen nicht, Weisungen bezüglich des laufenden Betriebs oder einzelne Entscheidungen über den Bau oder die Modernisierung von Fernleitungen und Verteilerleitungen zu erteilen, die über den Rahmen des genehmigten Finanzplans oder eines gleichwertigen Instruments nicht hinausgehen;","construction, equivalent, permit, instrument, company, parent, distribution",0.005034460682273033,0.04694835680751174,0.9146354794502258,instrument
The manufacturer shall keep the technical documentation at the disposal of the national authorities for 10 years after the last instrument has been manufactured.,Der Hersteller hält die technischen Unterlagen zehn Jahre lang nach Herstellung des letzten Gerätes für die nationalen Behörden bereit.,instrument,0.007575731225158965,0.024390243902439025,0.958946704864502,instrument
a rate of interest that discounts the nominal amount of the instrument to the current cash sales price of the goods or services.,"der Zinssatz, mit dem der Nominalbetrag der Einnahmen auf den gegenwärtigen Barzahlungspreis für die verkauften Erzeugnisse, Waren oder Dienstleistungen des Basisgeschäftes diskontiert wird.","interest, sales, instrument, goods",0.007280538953653107,0.01937984496124031,0.9395323395729065,instrument
specify the characteristics of different classes of instruments to be taken into account by the regulated market when assessing whether an instrument is issued in a manner consistent with the conditions laid down in the second subparagraph of paragraph 1 for admission to trading on the different market segments which it operates;,"die Eigenschaften verschiedener Kategorien von Instrumenten festgelegt werden, die vom geregelten Markt bei der Prüfung der Frage zu berücksichtigen sind, ob ein Instrument in einer Art und Weise begeben wurde, die den Bedingungen des Absatzes 1 Unterabsatz 2 für die Zulassung zum Handel in den von ihm betriebenen Marktsegmenten entspricht;","instrument, admission, account",0.0047930936429026,0.04638218923933209,0.9020182490348816,instrument
"The work programmes shall specify the minimum number of participants required for each indirect action and also their place of establishment, according to the nature of the instrument and the objectives of the R& TD activity.",In den Arbeitsprogrammen werden je nach Art des Instruments und den Zielen der FTEA-Tätigkeit die bei einer indirekten Maßnahme verlangte Mindestzahl an Teilnehmern und der Ort ihres Sitzes festgelegt.,instrument,0.004744188024111083,0.032362459546925564,0.9430179595947266,instrument
"It shall not permit the parent company to give instructions regarding day-to-day operations, nor with respect to individual decisions concerning the construction or upgrading of transmission and distribution lines, that do not exceed the terms of the approved financial plan, or any equivalent instrument;","Dies erlaubt es dem Mutterunternehmen nicht, Weisungen bezüglich des laufenden Betriebs oder einzelne Entscheidungen über den Bau oder die Modernisierung von Fernleitungen und Verteilerleitungen zu erteilen, die über den Rahmen des genehmigten Finanzplans oder eines gleichwertigen Instruments nicht hinausgehen;","construction, equivalent, permit, instrument, company, parent, distribution",0.005034460682273033,0.04694835680751174,0.9146354794502258,parent
"In some circumstances, it is appropriate to include all borrowings of the parent and its subsidiaries when computing a weighted average of the borrowing costs;","In manchen Fällen ist es angebracht, alle Fremdkapitalaufnahmen des Mutterunternehmens und seiner Tochterunternehmen in die Berechnung des gewogenen Durchschnittes der Fremdkapitalkosten einzubeziehen.","costs, parent",0.008301095462822575,0.0617283950617284,0.9467398524284363,parent
the turnover of each parent company in the preceding financial year;,"den Umsatz der einzelnen Muttergesellschaften im vorangegangenen Geschäftsjahr,","company, parent",0.0,0.0,0.9693694710731506,parent
"IN ADDITION , AN UNDERTAKING NEED NOT BE INCLUDED IN CONSOLIDATED ACCOUNTS WHERE : (A) SEVERE LONG-TERM RESTRICTIONS SUBSTANTIALLY HINDER : (AA) THE PARENT UNDERTAKING IN THE EXERCISE OF ITS RIGHTS OVER THE ASSETS OR MANAGEMENT OF THAT UNDERTAKING; OR","Außerdem braucht ein Unternehmen auch dann nicht in die Konsolidierung einbezogen zu werden, wenn a) erhebliche und andauernde Beschränkungen aa) die Ausübung der Rechte des Mutterunternehmens in bezug auf Vermögen oder Geschäftsführung dieses Unternehmens","rights, parent, term",0.005381887058206485,0.1514415289925494,0.8741825819015503,parent
the parent's interest in those adjusted carrying amounts;,dem Anteil des Mutterunternehmens an diesen angepassten Buchwerten und,"interest, parent",0.0,0.0,0.9636595845222473,parent
"It shall not permit the parent company to give instructions regarding day-to-day operations, nor with respect to individual decisions concerning the construction or upgrading of transmission and distribution lines, that do not exceed the terms of the approved financial plan, or any equivalent instrument;","Dies erlaubt es dem Mutterunternehmen nicht, Weisungen bezüglich des laufenden Betriebs oder einzelne Entscheidungen über den Bau oder die Modernisierung von Fernleitungen und Verteilerleitungen zu erteilen, die über den Rahmen des genehmigten Finanzplans oder eines gleichwertigen Instruments nicht hinausgehen;","construction, equivalent, permit, instrument, company, parent, distribution",0.005034460682273033,0.04694835680751174,0.9146354794502258,permit
"The special fishing permit referred to in Article 3, or an authenticated copy thereof, shall be carried on board fishing vessels and shall be available at all times for inspection by a CCAMLR inspector.",Die in Artikel 3 genannte spezielle Fangerlaubnis oder eine beglaubigte Kopie davon ist auf dem Fischereifahrzeug mitzuführen und muss einem CCAMLR-Inspektor jederzeit zur Überprüfung vorgelegt werden können.,"copy, article, permit",0.0065958005888164355,0.051903114186851215,0.9432414770126343,permit
each batch is split in order to permit it to be stored at two separate geographical sites under the responsibility of the designated premises of the Community antigen and vaccine bank;,"Jede Partie ist so aufgeteilt, dass sie unter der Verantwortung der bezeichneten Lagerstätten der gemeinschaftlichen Antigen- und Impfstoffbank an zwei separaten Standorten gelagert werden kann.","premises, order, bank, permit",0.0,0.0,0.9158641695976257,permit
permit the meat covered by the arrangements to be traced administratively throughout the period of storage;,"muss während der gesamten Lagerzeit die verwaltungstechnische Rückverfolgbarkeit des Fleisches, für das die Regelung gilt, ermöglichen;",permit,0.01022608696740623,0.026595744680851064,0.9587491750717163,permit
"By way of derogation from that condition, the competent authority may permit the slaughter of ruminants in slaughterhouses collecting non-ruminant blood intended for the production of blood meal and blood products for use in fish feed if these slaughterhouses have a recognised control system.","Abweichend von dieser Auflage kann die zuständige Behörde die Schlachtung von Wiederkäuern in Schlachthöfen genehmigen, die Blut von Nichtwiederkäuern zum Zweck der Herstellung von Blutmehl und Blutprodukten zur Verwendung in Fischfutter sammeln, wenn diese Schlachthöfe über ein anerkanntes Kontrollsystem verfügen.","use, authority, permit, control, competent, condition",0.005653171078511422,0.046189376443418015,0.9141893982887268,permit
"The CRL, together with ENGL, shall provide further information about the operational procedures of the validation process and shall make the documents available.",Das GRL und das Netz ENGL werden weitere Angaben zu den konkreten Abläufen des Validierungsprozesses machen und Unterlagen zur Verfügung stellen.,"process, information, make",0.008640609739997756,0.044642857142857144,0.9426981806755066,information
"For the purpose of measuring the percentage change, either upward or downward, in the purchasing power of salaries in the national civil services, Eurostat shall, on the basis of information supplied before the end of September by the national authorities concerned, calculate specific indicators reflecting changes in the real remuneration of civil servants in central government, between the month of July of the previous year and the month of July of the current year.","Um zu ermitteln, inwieweit sich die Kaufkraft der Gehälter im öffentlichen Dienst der Mitgliedstaaten prozentual erhöht oder verringert hat, stellt Eurostat anhand der Angaben, die bis Ende September von den betreffenden nationalen Behörden eingegangen sind, spezifische Indikatoren auf, aus denen hervorgeht, wie sich die realen Dienstbezüge der nationalen Beamten in den Zentralverwaltungen zwischen dem Monat Juli des Vorjahres und dem Monat Juli des laufenden Jahres entwickelt haben.","information, civil, government",0.00397810118142876,0.08701472556894245,0.9269407391548157,information
It is necessary to ensure a reasonable level of quality in the information disseminated and the maintenance of existing statistical series.,Die verbreiteten Daten müssen eine akzeptable Qualität aufweisen und die vorhandenen statistischen Reihen müssen gepflegt werden.,"information, reasonable",0.008687475782716616,0.02857142857142857,0.9704183340072632,information
This information shall be provided annually and at the latest in the documents accompanying the preliminary draft budget.,"Die Angaben werden jährlich rechtzeitig vorgelegt, und zwar spätestens zusammen mit den Dokumenten zum Haushaltsvorentwurf.","information, draft",0.010182425646195498,0.02906976744186046,0.9626715183258057,information
"If it is impracticable to disclose any of this information, this fact should be disclosed.","Sofern dies im Einzelfall nicht durchführbar oder wirtschaftlich nicht vertretbar ist, ist diese Tatsache anzugeben.","information, fact",0.013679192123121896,0.058823529411764705,0.9722080826759338,information
The product under investigation is certain ring binder mechanisms consigned from Thailand (the product under investigation) normally declared under the same codes as the product concerned originating in China.,"Bei der von der Untersuchung betroffenen Ware handelt es sich um bestimmte aus Thailand versandte Ringbuchmechaniken (nachstehend ""untersuchte Ware"" genannt), die normalerweise denselben KN-Codes zugewiesen werden wie die betroffene Ware mit Ursprung in der VR China.","binder, investigation",0.011879907409116954,0.14242697982535382,0.9257944822311401,binder
ending book inventory;,"End-Buchbestand,",inventory,0.0,0.0,0.9795508980751038,binder
"an agricultural land of the holding, including the parcels on set aside.",landwirtschaftliche Flächen des Betriebs einschließlich stillgelegter Parzellen.,"holding, land, set",0.01428363257865929,0.058139534883720936,0.9515320658683777,binder
company or workshop name.,Name des Unternehmens oder der Werkstatt.,company,0.036015288308423515,0.14705882352941174,0.9777119159698486,binder
Database,Datenbank,database,0.0,0.0,0.9847243428230286,binder
The product under investigation is certain ring binder mechanisms consigned from Thailand (the product under investigation) normally declared under the same codes as the product concerned originating in China.,"Bei der von der Untersuchung betroffenen Ware handelt es sich um bestimmte aus Thailand versandte Ringbuchmechaniken (nachstehend ""untersuchte Ware"" genannt), die normalerweise denselben KN-Codes zugewiesen werden wie die betroffene Ware mit Ursprung in der VR China.","binder, investigation",0.011879907409116954,0.14242697982535382,0.9257944822311401,investigation
"it is also necessary to set out the rules and procedures to be followed during the investigation, in particular the rules whereby interested parties are to make themselves known, present their views and submit information within specified time limits, if such views and information are to be taken into account;","Es ist ebenfalls angezeigt, die Regeln und Verfahren festzulegen, die bei einer Untersuchung zu befolgen sind, insbesondere die Regeln, nach denen sich Betroffene innerhalb bestimmter Fristen melden, ihre Auffassungen darlegen und Informationen vorlegen sollen, damit diese Auffassungen und Informationen berücksichtigt werden können.","make, submit, investigation, rules, set, information, account",0.004458815748575231,0.030303030303030307,0.9284231066703796,investigation
The Board may hear investigating officials from OLAF in cases where an investigation was initiated by the Office.,"Hat das Europäische Amt für Betrugsbekämpfung eine Untersuchung eingeleitet, so kann der Disziplinarrat ermittelnde Beamte dieses Amtes hören.",investigation,0.00966036738862109,0.02512562814070352,0.9345396757125854,investigation
POWERS OF INVESTIGATION,ERMITTLUNGSBEFUGNISSE,investigation,0.0,0.0,0.9909377098083496,investigation
"It was considered appropriate during the original investigation to impose duties in the form of a specific amount per tonne, since PET prices can fluctuate in line with fluctuations in crude oil prices, thus significantly affecting the level of the duty.","Bei der ursprünglichen Untersuchung wurde die Einführung der Zölle in Form eines festen Betrags pro Tonne als angemessen erachtet, da die PET-Preise infolge schwankender Erdölpreise Fluktuationen ausgesetzt sein können, die sich auch erheblich auf die Höhe des Zolls auswirken.","investigation, duty",0.005919382824640357,0.07109004739336491,0.9261797666549683,investigation
